game_name,price,link,description
Marsupilami: Hoobadventure! - Tropical Edition...,£24.99  £19.99,https://www.simplygames.com//p/marsupilami-hoobadventure---tropical-edition-ps4,"DescriptionDiscover the Marsupilamis as you have never seen them before in an adventure full of surprises!Punch, Twister and Hope are three Marsupilamis who live a peaceful life in Palombia. While the three companions open a cursed sarcophagus by playing with debris on a beach, they inadvertently release a mysterious ghost that puts a terrible curse on all animals. Fortunately for them, the Marsupilamis are immune. Our three heroes will have to go on an adventure and chase the ghost in order to ward off the spell.Features:3 different worlds.20+ levels.Adjustable difficulty for more challenge.Refined graphics, a colorful art style and immersive environments.A Chrono mode to break records.Discover and collect bonuses to unlock secret levels."
One Piece Odyssey...,£39.99,https://www.simplygames.com//p/one-piece-odyssey-ps4,"DescriptionJoin this brand-new RPG featuring new character and monster designs produced by Eiichiro Oda, the author of ONE PIECE. The game is also complemented by the beautiful music of Motoi Sakuraba, a composer well known for his various contributions to video games such as the Dark Souls and Tales of series.A broken Thousand Sunny… Scattered crew members… Luffy’s missing straw hat…During their voyage, the Straw Hats, led by Monkey D. Luffy are swallowed by a huge storm at sea. They end up on a mysterious island full of nature amidst the storm and become separated from each other. The crew sets out on a new adventurous journey filled with wonders of a raging nature, powerful enemies and strange encounters with island locals. Work together with Luffy and his crew to set sail once again!FeaturesA MYSTERIOUS ISLAND: Luffy decides to scout the island to meet up with his scattered crew members. They come across various mysterious ruins and never-before-seen monsters. Although excited to scout the island together, things soon take an unexpected turn. Discover and experience an original storyline!STRAW HATS AS ONE: Defeat new enemies, unravel mysteries and unearth a whole adventure with your favourite Straw Hats! In addition to Luffy, you can play as Zoro, Nami, Usopp, Sanji, Chopper, Robin, Frankie and Brook!RPG WITH A ONE PIECE TWIST: Experience quests and dungeons all with an authentic ONE PIECE twist. Enjoy what you love about RPGs but with your favorite characters and an original touch from the ONE PIECE universe."
New Joe & Mac: Caveman Ninja - T-Rex Edition...,£24.99  £19.99,https://www.simplygames.com//p/new-joe--mac-caveman-ninja---t-rex-edition-ps4,"DescriptionWelcome to the prehistoric jungle! Journey back in the distant Past, when “Rock & Roll” was just about rocks and “Fast food” was a dinner that you couldn’t catch. 2 cave dudes named Joe & Mac live in a peaceful and cool village. Cool it was, until a bogus bunch of Neanderthal snatched all the village’s women. It’s now up to Joe & Mac to save them all, and fight against deadly dinosaurs and carnivorous plants in this crazy and colourful action-platformer from the Jurassic times, with completely redesigned graphics! The HD version of this famous arcade game is still fun and quirky, but also longer, better, faster, and stronger… A BRAND NEW DESIGN: Experience a full and faithful remake of the arcade original game with new graphics, new sounds, and better control for an unprecedented experience. The T-Rex edition includes the base game, 2 sticker sheets, a 3D keychain and some trading cards!"
Crisis Core : Final Fantasy VII Reunion...,£34.99,https://www.simplygames.com//p/crisis-core--final-fantasy-vii-reunion-ps4,"DescriptionCRISIS CORE –FINAL FANTASY VII– REUNIONis a remaster of the original CRISIS CORE –FINAL FANTASY VII-, featuring a complete HD graphics overhaul, a remastered soundtrack, a reimagined UI, and an updated combat system.The story begins seven years before the events of FINAL FANTASY VII (1997) and follows Zack Fair, a young and ambitious Shinra SOLDIER operative. Zack is tasked with tracking down a missing SOLDIER 1st Class operative named Genesis Rhapsodos.But as his adventure unfolds, he discovers the dark secrets of Shinra’s experiments and the monsters they create. The game features a number of characters from the FINAL FANTASY VII franchise such as Cloud, Sephiroth, Aerith and others."
The House of the Dead - Limidead Edition...,£24.99  £19.99,https://www.simplygames.com//p/the-house-of-the-dead---limidead-edition-ps4,"DescriptionThe famous Zombie shooter is back in a full remake! Renew the spirit of Arcade from the nineties with the remake of this iconic shooter!A scientist and expert on the Human Genome Theory, Dr. Roy Curien, descends into insanity as he searches for a power that allows him to resurrect the dead. After he succeeds, one of the researchers named Sophie Richards manages to contact her AMS friends Thomas Rogan and Agent G for help. Their mission is to stop the mad scientist and rescue all the laboratory staff, by making their way through the mansion, while fending off hordes of zombies.Alone or with a friend, fight against zombies and nightmare creatures in this gory and uninhibited zombie shooter.The Limidead edition includes the base game, an exclusive lenticular box, 2 character stands and a sticker sheet."
Gungrave G.O.R.E - Day One Edition...,£36.95,https://www.simplygames.com//p/gungrave-gore---day-one-edition-ps4,"DescriptionGungrave G.O.R.E is a stylish third-person action shooter by South-Korean Studio IGGYMOB in which you take on the role of Grave, a gunslinger of resurrection and badass anti-hero of your dreams, mowing down tons of enemies in a gory ballet of bullets.  In the near future, the Seed, a dangerous alien drug re-surfaces and spreads all over the world. You are “Grave” a former Mafia hitman, killed, revived and turned into a one-man army, a Gunslinger of Resurrection devoid of emotions but obsessed with eradicating the Seed and protecting your adopted daughter, Mika.  Prepare for an epic quest across South-East Asia and exact your vengeance."
Doctor Who: Duo Bundle...,£24.99  £11.99,https://www.simplygames.com//p/doctor-who-duo-bundle-ps4,"DescriptionTWO DOCTORS, TWO THRILLING ADVENTURES.Come face to face with Weeping Angels, Cybermen, Daleks, and more! Join the Thirteenth Doctor (Jodie Whittaker) and Tenth Doctor (David Tennant) on an epicadventure in space and time in Doctor Who: The Edge of Reality, and team up with Petronella Osgood to solve a chilling found-phone mystery in Doctor Who: The Lonely Assassins.Doctor Who: The Edge of Reality – Deluxe Edition Key Features:ORIGINAL DOCTOR WHO STORY: Enter the Chaosverse, where reality itself is threatened by a series of time-breaking glitches, and partner with two formidable Doctors as you seek to uncover a deeper mystery.NEW NEMESIS REVEALED: Face classic Doctor Who monsters, including Daleks, Weeping Angels and Cybermen, and confront a terrifying new threat: the CyberReaper.THRILLING SCI-FI ADVENTURE: Now for non-VR platforms, Doctor Who: The Edge of Reality features new challenges, new locations and new characters (including the Tenth Doctor), with a reimagined and expanded story that builds on the previous game The Edge of Time.Doctor Who: The Edge of Reality - Deluxe Edition includes: Ninth Doctor’s Sonic Screwdriver, Tenth Doctor’s Sonic Screwdriver, Eleventh Doctor’s Sonic Screwdriver, Twelfth Doctor’s Sonic Screwdriver, Gallifreyan leather gloves, Twelfth Doctor's leather gloves, Cyberman gloves, and River Song's gloves.Doctor Who: The Lonely Assassins Key Features:ORIGINAL DOCTOR WHO STORY: Picking up where the iconic episode “Blink” left off, the Weeping Angels are back to unleash terror once again...PETRIFYING NEW NEMESIS: Confront an evil like never before. No phone is safe!AUTHENTIC CHARACTERS: Work alongside Petronella Osgood (played by Ingrid Oliver) to investigate mysterious events. Also features Finlay Robertson as Larry Nightingale and a special appearance by Jodie Whittaker as the voice of the Doctor.FOUND - PHONE MYSTERY: Search through messages, emails, videos, photographs and more to uncover clues, solve puzzles and reveal the truth."
Sonic Frontiers...,£39.99  £19.99,https://www.simplygames.com//p/sonic-frontiers-ps4,"DescriptionExperience Sonic like never before!Worlds are colliding in Sonic the Hedgehog’s newest high-speed adventure! In search of the missing Chaos emeralds, Sonic becomes stranded on an ancient island teeming with unusual creatures. Battle hordes of powerful enemies as you explore a breathtaking world of action, adventure, and mystery. Accelerate to new heights and experience the thrill of high-velocity, open-zone platforming freedom as you race across the five massive Starfall Islands. Jump into adventure, wield the power of the Ancients, and fight to stop these new mysterious foes. Welcome to the evolution of Sonic games!Experience All-New Open Zone PlatformingRace across five massive overworld islands brimming with dense forests, overflowing waterfalls, and sizzling desert landscapes, each with their own unique action-platforming challenges and hidden secrets to uncover.Unparalleled High-Speed FreedomAdventure across the Starfall Islands and see what each has to offer at the speed that only Sonic can deliver. Blaze a trail as you see fit and discover side quests, solve puzzles, scale enormous structures, go fishing, and encounter a friendly face or two along the way…Challenge Yourself In Cyber SpaceDiscover portals scattered across the island and venture into Cyber Space levels through portals scattered across the islands featuring signature 3D platforming at Sonic speeds, packed with challenges to put your skills to the test.Cyber-Powered CombatThe Starfall Islands are home to strange creatures Sonic has never encountered before. Use the all-new battle system and skill tree upgrades to fight strategically, combining moves such as dodges, parries, counters, combos, and the new Cyloop ability to take down mysterious foes and colossal titans.A New Adventure Full of Mystery and IntrigueBecome Sonic and journey to uncover the mysteries of the remains of an ancient civilization plagued by robotic hordes. With nothing but a handful of questions and a disembodied voice to guide you, set out to save your friends and the enigmatic inhabitants of the Starfall Islands from a colossal, mechanized threat."
Star Ocean: The Divine Force...,£29.99,https://www.simplygames.com//p/star-ocean-the-divine-force-ps4,"DescriptionWhen two heroes cross paths, the fate of the universe awakens.  On a routine transport mission, Raymond Lawrence's spaceship is attacked by the Pangalactic Federation and he crash-lands on an underdeveloped planet.  He then encounters Princess Laeticia, who is fighting to protect her homeland from an invading empire. Together, they set off on an adventure that will shake the foundations of the entire universe.  STAR OCEAN THE DIVINE FORCE features an original story with two individual narratives and many playable characters, a unique combat system, and the freedom to soar in the skies and explore planets.  Featuring a blend of sci-fi and fantasy, this fresh Action RPG has challenging yet thrilling battle experiences, with high-speed movement in 360-degrees!"
Session: Skate Sim...,£19.99,https://www.simplygames.com//p/session-skate-sim-ps4,"DescriptionInspired by the golden age of street skating – the 1990s – Session: Skate Sim lets you experience true skateboarding and its culture. No scoring system; just you, your spot, and your imagination! There's no need for judges to tell you that your noseslide or varial heelflip are perfect for this spot. The developers have added several iconic skate locations to the game for you to skate in and express your creativity, including Black Hubbas (New York City), Brooklyn Banks (New York City), FDR Park (Philadelphia), and many other spots.Key Features:AUTHENTIC GAMEPLAY: With the dual stick controls, each stick represents one of your feet. You will need to learn how to control them and transfer weight, just like on a real skateboard. The physics have been developed with a focus on realism, smoothness, and immersion. Just like in real life for a new skateboarder, the first hours can seem challenging, but once you have mastered the technique, you will feel the unrivaled thrill of pulling off your very first kickflip!""IF IT WASN'T CAUGHT ON VIDEO, IT DIDN'T HAPPEN”: Skating and pulling off the best lines in the best spots is one thing, but if no one is there to film it, it didn't really happen… In Session: Skate Sim, you can film with a 1990s filter or fisheye lens, and you can use the video editor to create your clips and share them. You can play with multiple options, including changing the field of view, time of day, filters, and different camera views (tripod, orbit, etc.). Session: Skate Sim also offers the chance to go from skater to filmmaker: pull off your moves then go into film mode to experience the action from the point of view of your camera operator and create the best clip.CUSTOMISATION: Show off your style with an extensive customisation system for your skater and skateboard. By completing challenges, you earn money to spend in skate shops. You can find nearly 200 items from top brands, such as Fallen, Zero, GrindKing, Thankyou, HIJINX Net, Antilanta, Roger Skate CO, No-Comply, and others. You can also customise your skateboard with over 250 parts from famous brands like No-Comply, GindKing, Thankyou, and many others. In addition to the design aspect, the components (trucks, riser pads, wheels…) impact the way you skate. Find the right ones for your style and shred the most iconic spots!"
LEGO Brawls...,£24.99,https://www.simplygames.com//p/lego-brawls-ps4,"DescriptionLEGO Brawls, developed in partnership with RED Games, is a fast-paced LEGO take on multiplayer platforming, full of building, rebuilding and uniquely LEGO brick humour. The key inspiration for the title is a game where players literally build their own Heroes. By design, winning is a team-collaboration, working together to build and control contraptions within the levels, while battling the other team.Build your way to the top in this light-hearted, team action brawler where anything can happen.Design your own heroic minifig with unique brawling abilities!Build ridiculous power-ups out of bricks!Work with your team to control iconic LEGO levels!Compete in NINJAGO, Castle, and Pirate arenas!Expand your collection of minifigs and power-ups!Become the ultimate brawler!"
Soul Hackers 2...,£42.99,https://www.simplygames.com//p/soul-hackers-2-ps4,"DescriptionAmidst the glimmer of neon lights, technological advancement causes humans to be consumed by commercial convenience. In the shadows, a war between the Yatagarasu and the Phantom Society is brewing, Devil Summoners who harness the otherworldly powers of “Demons”. Existing in the secret sea of humanity’s data, a digital hivemind has evolved into sentience: Aion. Observing humankind from afar, Aion calculates that a world-ending disaster is imminent and creates two agents to combat against it: Ringo and Figue. Together, these agents of Aion must investigate and prevent a butterfly effect that will lead to the end of the world."
Saints Row Notorious Edition...,£39.99,https://www.simplygames.com//p/saints-row-notorious-edition-ps4,"DescriptionWelcome to Santo Ileso, a vibrant fictional city in the heart of the American Southwest. In a world rife with crime, where lawless factions fight for power, a group of young friends embark on their own criminal venture, as they rise to the top in their bid to become Self Made. As the future Boss, with Neenah, Kevin, and Eli by your side, you’ll form The Saints – and take on Los Panteros, The Idols, and Marshall as you build your empire across the streets of Santo Ileso and battle for control of the city. Ultimately Saints Row is the story of a start-up company, it’s just that the business The Saints are in happens to be crime. Experience the biggest and best Saints Row playground ever created; the unique sprawling world of Santo Ileso is the backdrop for a wild, larger than life sandbox of thrilling side hustles, criminal ventures and blockbuster missions, as you shoot, drive, and wingsuit your way to the top. Express yourself and unleash your inner Saint, with the most advanced suite of customization tools yet seen in an open-world game – make your character, your car and your crew your own. Dive into epic gunfights and highspeed chases, and witness outrageous only-in-Saints-Row moments in an original story that charts the Saints’ remarkable rise to power. Enjoy the freedom of playing the entire campaign with a friend through seamless untethered co-op play, where you can both push the limits of your gang and create your own gameplay. The Notorious Edition is a special collection of exclusive physical items; this is the ultimate creation for serious Saints Row fans and collectors! In addition to the full game and Expansion Pass, the Notorious Edition features a huge stack of exclusive items offering an in-depth look into the Saints gang and the criminal world of Santo Ileso.The Notorious Edition includes all of the following:• Exclusive SteelBook® with game disc• Expansion Pass• Double-sided poster (66cm(W) x 39.3cm(H))• Mini Artbook• 4 Santo Ileso postcards• 4 character art cards• Bonus -Los Panteros American Muscle Bundle• Bonus - The Saints Criminal Customs Los Panteros American Muscle Bundle - featuring the Los Panteros 'El Lanzador' Heavy Weapon skin and Custom 'Fury' Motorcycle. Saints Criminal Customs – includes two specially adorned bonus items; the Saints Custom Convertible and Saints Custom Stab Jacket."
Saints Row Day One Edition...,£24.99  £9.99,https://www.simplygames.com//p/saints-row-day-one-edition-ps4,"DescriptionWelcome to Santo Ileso, a vibrant fictional city in the heart of the American Southwest. In a world rife with crime, where lawless factions fight for power, a group of young friends embark on their own criminal venture, as they rise to the top in their bid to become Self Made.As the future Boss, with Neenah, Kevin, and Eli by your side, you’ll form The Saints – and take on Los Panteros, The Idols, and Marshall as you build your empire across the streets of Santo Ileso and battle for control of the city. Ultimately Saints Row is the story of a start-up company, it’s just that the business The Saints are in happens to be crime.Experience the biggest and best Saints Row playground ever created; the unique sprawling world of Santo Ileso is the backdrop for a wild, larger than life sandbox of thrilling side hustles, criminal ventures and blockbuster missions, as you shoot, drive, and wingsuit your way to the top.Express yourself and unleash your inner Saint, with the most advanced suite of customization tools yet seen in an open-world game – make your character, your car and your crew your own.Dive into epic gunfights and highspeed chases, and witness outrageous only-in-Saints-Row moments in an original story that charts the Saints’ remarkable rise to power. Enjoy the freedom of playing the entire campaign with a friend through seamless untethered co-op play, where you can both push the limits of your gang and create your own gameplay moments together.Witness the Birth of The Saints – Play through an action blockbuster original story full of criminality, extraordinary scenes and signature surprises laced with humor.Discover the Weird, Wild, West – Dive in to Santo Ileso, the biggest and best Saints Row playground ever, spread across nine unique districts surrounded by the vast, majestic beauty of the Southwest Desert.Build Your Criminal Empire – Take over the city block by block, wage war against enemy factions and tighten your grip on the streets with ingenious criminal ventures.Fire Guns. LOTS of Guns – Shoot revolvers from the hip, fire and forget with a rocket launcher, or obliterate up close using melee heavyweights, complete with brutal takedowns. A vast variety of familiar and exotic weapons, all customizable, and all deadly fun.Take to the Streets and the Skies – Blast through urban and desert environments in any one of the cars, bikes, planes, helicopters, VTOLs, hoverbikes, hoverboards, go-karts or equip your wingsuit to swoop around.Unprecedented Customization – Create the Boss of your dreams, with the most extensive character customization suite ever seen in the series, then complete the look with incredible options for weapons and vehicles.Seamless Co-Op – Experience everything on offer with a friend at any time, via fully untethered drop-in / drop out co-op, skipping the need to take either of you out of the outlandish action. Play nice together, or play all new pranks on your team mate. After all, who’s the Boss now.Pre-order now and get the Idols Anarchy Pack.Let loose your inner anarchist! Tear up the streets of Santo Ileso with The Idols Anarchy Pack.Don the iconic digitized DJ Helmet to light up your enemies faces before smashing them unconscious with the Idols Twinkle Bat, all to the sound of broken glass, then speed off on your stolen neon-illuminated Sandstorm Scrambler bike.The Idols Anarchy Pack includes:• Idols DJ Helmet• Idols Twinkle Bat• Idols Sandstorm Scrambler"
Two Point Campus - Enrolment Edition...,£29.99  £9.99,https://www.simplygames.com//p/two-point-campus---enrolment-edition-ps4,"DescriptionBuild your university, your way! It’s time to spin academia on its head! Got a yearning for learning? Or just keen to build an educational masterpiece? Campus is jam-packed with new creative tools to help you build the university of your dreams. For the first time, build in the great outdoors as you develop your own delightfully educational campus environment, housing the top teaching facilities in the land. Whether you prefer building on simple foundations, or placing every tree, you can build the university you want. Lay down pathways with new easy-to-use tools. Plant glorious collections of outdoor flora. Place benches, fountains, sculptures, hedgerows – even picket fences. The only limit is your imagination (and your in-game bank balance). Not the usual fare But, of course, it wouldn’t be a Two Point game without a twist. Rather than typical academic fare, students in Two Point County enjoy a range of wild and wonderful courses: from Knight School (hey, we all have to learn jousting at some point in our lives), to the salivatory Gastronomy, where your students will build mouth-watering concoctions like giant pizzas and enormous pies. The academic year… is here!"
Under Night In-Birth Exe:Late(ST)...,£19.99,https://www.simplygames.com//p/under-night-in-birth-exelatest-ps4,"DescriptionMade by the same developer of “Melty Blood”, developer French Bread is bringing this classic 2D arcade series,UNDER NIGHT IN-BIRTH Exe:Late to PS4 platform.Strongly emphasizing it's setting base on novel, and can perform stunning combos with simple mechanics, this is veryrare in arcade games. Normally arcade game settings derive from movies or manga which have a complete individualtheme, and use game as an extension. An arcade game base on novel is very unique.The story mode in this game (Chronicle mode) begins with every character's introduction. In story mode no battle willhappen, therefore it's suitable for everyone to play."
Klonoa Phantasy Reverie Series...,£24.99,https://www.simplygames.com//p/klonoa-phantasy-reverie-series-ps4,"DescriptionKlonoa is back! Klonoa Phantasy Reverie Series brings back ""Klonoa: Door to Phantomile"" and ""Klonoa 2: Lunatea's Veil"" remastered in one collection to fans new and old. Get ready to set off on an adventure to save the world!Released initially in 1997 by Namco, Klonoa is a side-scrolling platformer featuring a colourful character roster and vibrant game world, it's up to you as Klonoa to embark on a journey to save Phantomile.For the franchise's momentous twenty-fifth birthday, Klonoa: Door to Phantomile and Klonoa 2: Lunatea's Veil are receiving the remaster treatment in a two-in-one set, titled “Klonoa Phantasy Reverie Series”The graphics have received an elegant revamp while Klonoa's beloved world and classic gameplay have been faithfully preserved. The remaster also features an adjustable difficulty level, allowing franchise newcomers to delve right into the action, and long-time fans to get reacquainted with ease.Features:Two Games in One: Play ""Klonoa: Door to Phantomile"" and ""Klonoa 2: Lunatea's Veil"" in this compilation.Anniversary Remaster: Discover or rediscover the world of Klonoa in 60 FPS and up to 4K resolution.Iconic gameplay: Run and jump while using your Wind Ring to grab and throw your enemies.New Accessibility: Adjust the difficultly levels to test your skills & enlist a friend in 2 player co-op, if you need help."
